<?xml version="1.0" encoding="ISO-8859-1"?>
<!-- edited with XMLSPY v2004 rel. 3 U (http://www.xmlspy.com) by Stephan Dï¿½tsch (private) -->
<!-- copyright (c) 2004-2006, clip interactive GmbH, Switzerland  -->
<xs:schema xmlns:xs="http://www.w3.org/2001/XMLSchema">
	<xs:element name="issfcalendar">
		<xs:complexType>
			<xs:sequence>
				<xs:element name="championship" maxOccurs="unbounded">
					<xs:complexType>
						<xs:sequence>
							<xs:element name="site" type="xs:string"/>
							<xs:element name="nation" type="xs:string"/>
							<xs:element name="title" type="xs:string"/>
							<xs:element name="year" type="xs:int"/>
							<xs:element name="startdate" type="xs:date"/>
							<xs:element name="enddate" type="xs:date"/>
							
							<xs:element name="event" maxOccurs="unbounded">
							<xs:complexType>
								<xs:sequence>
									<xs:element name="date" />
									<xs:element name="issftitle" />
									
									<xs:element name="athlete" minOccurs="0" maxOccurs="unbounded">
									<xs:complexType>
										<xs:sequence>
											<xs:element name="name" type="xs:string"/>
										</xs:sequence>
									</xs:complexType>
									</xs:element>
									
								</xs:sequence>
								<xs:attribute name="id" type="xs:integer"/>
							</xs:complexType>
							</xs:element>
							
						</xs:sequence>
						<xs:attribute name="id" type="xs:integer"/>
					</xs:complexType>
				</xs:element>
			</xs:sequence>
		</xs:complexType>
	</xs:element>
</xs:schema>
